{
  "schema_version": "ninereeds_lesson_rehearsal_repair_receipt_v1",
  "parent_manifest_sha256": "44ec68d9a245f9039b89d394e51f40a97c773748730119b0e980fd0b4d13c350",
  "failure_codes": [
    "teacher_language_policy_missing_frozen_reserve_form"
  ],
  "root_causes": [
    "lesson_plan"
  ],
  "changed_artifacts": [
    {
      "path": "/home/aomukai/Ninereeds/output/lessons/L000-handhold-attempt-002/stages/08-rehearsal-setup/teacher-language-policy-frontier-additions-007.json",
      "before_sha256": null,
      "after_sha256": "84e1d2174ea0bdfdae60dcc0a4d9683ab9441b9df3148f0405c39a1a4f8db947"
    }
  ],
  "repair_rationale": "The conductor correctly froze before emitting neg-r01 because its exact frozen prompt was absent from the rehearsal language policy. A complete read-only audit found exactly two missing spoken strings: Are you Bob? and the later reserve Are you Bob or Ninereeds? Both are added to frontier_forms before the linked rerun. The lesson, actor prompts, hidden learner behavior, conductor effort, item order, and budgets remain unchanged.",
  "approved_by": "handhold_operator"
}
