{
  "schema_version": "ninereeds_lesson_rehearsal_repair_receipt_v1",
  "parent_manifest_sha256": "5ad5699e8af6ebfb092bf1991669ac628f1121d253755b59eb8f14e2407433c2",
  "failure_codes": [
    "initial_presentation_exact_turn_binding_missing",
    "present_again_replay_serialization_invalid",
    "adaptive_artifact_preflight_missing"
  ],
  "root_causes": [
    "harness",
    "luna_routine"
  ],
  "changed_artifacts": [
    {
      "path": "/home/aomukai/Ninereeds/mission_hub/skills/compile-next-lesson/scripts/rehearse_lesson.py",
      "before_sha256": "79aab0b902199e53288966797274352a26c36272dbbb12e45f8024d779ecdb54",
      "after_sha256": "cd58e004b8484cd165e4f689d4173581673267ac6b69f28827a8e3962e3152bf"
    },
    {
      "path": "/home/aomukai/Ninereeds/output/lessons/L001-handhold-attempt-002/stages/08-rehearsal/prompts/luna-conductor-high-v3.md",
      "before_sha256": "e5f1f4d498aa52d2e62fd3350a55f034fa540fdff358ba18f44bf44d7f046554",
      "after_sha256": "7d0eae771e67d1bf7107df8fad6e4388daddf69d7b9fbdb4476d774733537aa4"
    }
  ],
  "repair_rationale": "Run 003 exposed an admission-boundary defect: the harness validated language and generic machine controls but did not bind Luna's event to the exact frozen teacher turn. It therefore admitted generic WORKED_* summaries for the initial presentation, and the first PRESENT_AGAIN replay later failed because Luna serialized the wrong phase, delivery mode, text, and script reference. The harness now requires canonical exercise/teacher_turn_N references, exact text and delivery mode, unique ordinal emission, and an exact one-turn replay before a cold retest. The conductor prompt decomposes PRESENT_AGAIN into three separately linted artifacts. Because the blind verdict also identified a Luna routine failure at medium, the conductor advances exactly one effort rung to high; lesson bytes, visuals, learner profile, scenario, and scoring thresholds remain unchanged.",
  "approved_by": "handhold_operator"
}
