{
  "schema_version": "ninereeds_lesson_rehearsal_repair_receipt_v1",
  "parent_manifest_sha256": "0eb5bf927f67760f18aecbacaeb152b0d5ce284cba6a9a9a3aecfdbed68200fe",
  "failure_codes": [
    "adaptive_boundary_not_blocking",
    "preflight_failure_fell_through_to_append"
  ],
  "root_causes": [
    "harness"
  ],
  "changed_artifacts": [
    {
      "path": "/home/aomukai/Ninereeds/mission_hub/skills/compile-next-lesson/scripts/rehearse_lesson.py",
      "before_sha256": "cd58e004b8484cd165e4f689d4173581673267ac6b69f28827a8e3962e3152bf",
      "after_sha256": "85e1ab7197636c551d16f54375f1bc6cca7b1e52eb76646a057e1ace4b33bdff"
    },
    {
      "path": "/home/aomukai/Ninereeds/mission_hub/skills/compile-next-lesson/references/rehearsal-protocol.md",
      "before_sha256": "6010286008edaf17b4fa681a874d61aa04ef03d630c1f1b42f1b110229f366cc",
      "after_sha256": "edea5c6fbc84280791b7e6d5f3ffe6ffc089d47f9470fcb0166b66c63161beaa"
    }
  ],
  "repair_rationale": "Run 004 proved the exact-turn conductor repair but exposed a broker admission defect. Eight scored affirmative items were requested and admitted as one block, so the item-five failure could not open its mandatory PRESENT_AGAIN boundary before items six through eight advanced the cursor. A failed lint command was also followed by append in the same operator shell invocation. The harness now rejects any teacher artifact containing more than one scored exercise while still permitting multi-turn models and unscored interface checks. The protocol now requires item-atomic scored brokerage and a separate fail-stop lint operation before append. The lesson, visuals, actor prompts, learner profile, scenario, scoring thresholds, and high conductor effort remain unchanged.",
  "approved_by": "handhold_operator"
}
