{
  "schema_version": "ninereeds_lesson_rehearsal_repair_receipt_v1",
  "parent_manifest_sha256": "c5f5841f13f31ac87dab519da184b23a42a7b2a17d1c18e323d821c2ebe1631a",
  "failure_codes": [
    "static_rebuild_invalidated_prior_rehearsal",
    "local_presentation_and_comprehension_runtime_contract_changed"
  ],
  "root_causes": [
    "lesson_plan",
    "harness"
  ],
  "changed_artifacts": [
    {
      "path": "/home/aomukai/Ninereeds/output/lessons/L000-handhold-attempt-002/stages/06-assembly/lesson-draft-luna-medium-014.json",
      "before_sha256": "c6a4cce3102964f955866e346c5a2c2fc51908edf4375e47fa775eff77240105",
      "after_sha256": "1affeb86f382a6ed1f2e7ba016ca89fae1bbcbd17a54c6bc6d073c27334dc62b"
    },
    {
      "path": "/home/aomukai/Ninereeds/output/lessons/L000-handhold-attempt-002/stages/08-rehearsal-setup/luna-conductor-prompt-xhigh-005.md",
      "before_sha256": "66a2969428b38e335366b46906574559eceabfeb37eda3f920a2e85416645e40",
      "after_sha256": "5fa6b3463c699ab9e3bb00c3d069edd7f9af4bb9eba884226f0140291b79b717"
    }
  ],
  "repair_rationale": "The prior passing rehearsal covered a superseded lesson. The corrected lesson now interleaves every local presentation immediately before its controlled gate, adds the ninth hand-off page, introduces shortcut-resistant and fully counted comprehension machine actions, and makes all phase terminals and budgets executable. The conductor prompt is correspondingly rebound to the exact execution_sequence, distinct comprehension phase, 101-turn base path, and 230-turn ceiling. A new rehearsal is required because old learner evidence cannot certify changed lesson bytes.",
  "approved_by": "handhold_operator"
}
